[
  {
    "event_id": "EVT-DELTA-001-CREATED",
    "event_type": "created",
    "order_id": "ORD-DELTA-001",
    "customer_id": "CUST0001",
    "event_time": "2026-09-29T11:00:00Z",
    "channel": "web",
    "currency": "BOB",
    "total_cents": 20000,
    "original_payment_id": null,
    "items": [
      {
        "order_line_id": "ORD-DELTA-001-L01",
        "product_id": "PRD001",
        "quantity": 4,
        "unit_price_cents": 5000,
        "discount_cents": 0,
        "refund_cents": null
      }
    ]
  },
  {
    "event_id": "EVT-DELTA-001-PAID",
    "event_type": "paid",
    "order_id": "ORD-DELTA-001",
    "customer_id": "CUST0001",
    "event_time": "2026-09-29T11:05:00Z",
    "channel": "web",
    "currency": "BOB",
    "total_cents": 20000,
    "original_payment_id": null,
    "items": [
      {
        "order_line_id": "ORD-DELTA-001-L01",
        "product_id": "PRD001",
        "quantity": 4,
        "unit_price_cents": 5000,
        "discount_cents": 0,
        "refund_cents": null
      }
    ]
  },
  {
    "event_id": "EVT-DELTA-002-CREATED",
    "event_type": "created",
    "order_id": "ORD-DELTA-002",
    "customer_id": "CUST0001",
    "event_time": "2026-09-29T12:00:00Z",
    "channel": "movil",
    "currency": "BOB",
    "total_cents": 12000,
    "original_payment_id": null,
    "items": [
      {
        "order_line_id": "ORD-DELTA-002-L01",
        "product_id": "PRD002",
        "quantity": 4,
        "unit_price_cents": 3000,
        "discount_cents": 0,
        "refund_cents": null
      }
    ]
  },
  {
    "event_id": "EVT-DELTA-002-PAID",
    "event_type": "paid",
    "order_id": "ORD-DELTA-002",
    "customer_id": "CUST0001",
    "event_time": "2026-09-29T12:05:00Z",
    "channel": "movil",
    "currency": "BOB",
    "total_cents": 12000,
    "original_payment_id": null,
    "items": [
      {
        "order_line_id": "ORD-DELTA-002-L01",
        "product_id": "PRD002",
        "quantity": 4,
        "unit_price_cents": 3000,
        "discount_cents": 0,
        "refund_cents": null
      }
    ]
  },
  {
    "event_id": "EVT-DELTA-003-CREATED",
    "event_type": "created",
    "order_id": "ORD-DELTA-003",
    "customer_id": "CUST0001",
    "event_time": "2026-09-29T13:00:00Z",
    "channel": "tienda",
    "currency": "BOB",
    "total_cents": 6000,
    "original_payment_id": null,
    "items": [
      {
        "order_line_id": "ORD-DELTA-003-L01",
        "product_id": "PRD002",
        "quantity": 2,
        "unit_price_cents": 3000,
        "discount_cents": 0,
        "refund_cents": null
      }
    ]
  },
  {
    "event_id": "EVT-DELTA-003-PAID",
    "event_type": "paid",
    "order_id": "ORD-DELTA-003",
    "customer_id": "CUST0001",
    "event_time": "2026-09-29T13:05:00Z",
    "channel": "tienda",
    "currency": "BOB",
    "total_cents": 6000,
    "original_payment_id": null,
    "items": [
      {
        "order_line_id": "ORD-DELTA-003-L01",
        "product_id": "PRD002",
        "quantity": 2,
        "unit_price_cents": 3000,
        "discount_cents": 0,
        "refund_cents": null
      }
    ]
  },
  {
    "event_id": "EVT-DELTA-001-REFUND",
    "event_type": "refunded",
    "order_id": "ORD-DELTA-001",
    "customer_id": "CUST0001",
    "event_time": "2026-09-30T12:00:00Z",
    "channel": "web",
    "currency": "BOB",
    "total_cents": 10000,
    "original_payment_id": "EVT-DELTA-001-PAID",
    "items": [
      {
        "order_line_id": "ORD-DELTA-001-L01",
        "product_id": "PRD001",
        "quantity": 2,
        "unit_price_cents": 5000,
        "discount_cents": 0,
        "refund_cents": 10000
      }
    ]
  }
]
