{"event_id":"EVT-INVALID-005","event_type":"created","order_id":"ORD-INVALID-005","customer_id":"CUST0001","event_time":"30/04/2026","channel":"web","currency":"BOB","total_cents":41800,"original_payment_id":null,"items":[{"order_line_id":"ORD-000001-L01","product_id":"PRD021","quantity":2,"unit_price_cents":4500,"discount_cents":0,"refund_cents":null},{"order_line_id":"ORD-000001-L02","product_id":"PRD043","quantity":4,"unit_price_cents":3400,"discount_cents":0,"refund_cents":null},{"order_line_id":"ORD-000001-L03","product_id":"PRD046","quantity":4,"unit_price_cents":4800,"discount_cents":0,"refund_cents":null}]}